{"protocol_version":1,"request_id":"9f2c4693-9a39-4323-9f37-f231348e2777","state":"succeeded","completed":true,"created_at_ms":1791245078319,"expires_at_ms":1791331549465,"result":{"run_id":"20261006-090438-543","camera_id":"0","profile_id":"camera2-standard-v2","artifact_count":1,"cancelled":false,"report_schema_version":5},"error":null,"artifacts":[{"artifact_id":"file-0","name":"20261006-090438-543.json","mime_type":"application\/json","size_bytes":6052713,"sha256":"390958bcce44a1d0e06b0302b4ef531f24f99f8b4f35d600fad8a4ef843ae59c"}]}