{"protocol_version":1,"request_id":"005efffd-a329-41f1-891b-c0a45a0cd3f1","state":"succeeded","completed":true,"created_at_ms":1791244741454,"expires_at_ms":1791331213520,"result":{"run_id":"20261006-085901-722","camera_id":"0","profile_id":"camera2-standard-v2","artifact_count":1,"cancelled":false,"report_schema_version":5},"error":null,"artifacts":[{"artifact_id":"file-0","name":"20261006-085901-722.json","mime_type":"application\/json","size_bytes":6080494,"sha256":"eb836440d57e7dbeecdfcf424998ed7f5e4acab19e0b561e2a906467ca879e77"}]}
