{"protocol_version":1,"request_id":"5bca42cc-c0b5-46c2-8115-68cfe4931bca","state":"succeeded","completed":true,"created_at_ms":1790485391918,"expires_at_ms":1790571802092,"result":{"camera_id":"0","recording":false,"audio":false,"cancelled":false,"artifact_count":1},"error":null,"artifacts":[{"artifact_id":"file-0","name":"recording_5bca42cc-c0b5-46c2-8115-68cfe4931bca.mp4","mime_type":"video\/mp4","size_bytes":10332614,"sha256":"594c3798a764f87f36c573c9a42be62952121a8027f2a633134f410898a032f9"}]}
