{"protocol_version":1,"request_id":"06863db6-88d6-4431-af6e-a31acbd65cd1","state":"succeeded","completed":true,"created_at_ms":1791213591272,"expires_at_ms":1791300036548,"result":{"camera_id":"0","recording":false,"audio":false,"cancelled":false,"engine":"CameraX","streams":{"preview":"1920x1080","recording":"3840x2160","recordingFormat":"Auto","snapshot":null},"artifact_count":1},"error":null,"artifacts":[{"artifact_id":"file-0","name":"recording_06863db6-88d6-4431-af6e-a31acbd65cd1.mp4","mime_type":"video\/mp4","size_bytes":55033881,"sha256":"df9f37536db2ef4aee6d7219c946d016bfd3ee09e3a07675e5be931f34a7b4e3"}]}
